- generate code

protoc --go_out=. --go_opt=paths=source_relative \
    --go-grpc_out=. --go-grpc_opt=paths=source_relative \
    helloworld/helloworld.proto

- packets

tshark -r data.pcap -d tcp.port==50051,http2
    1   0.000000    127.0.0.1 → 127.0.0.1    TCP 68 62142 → 50051 [SYN] Seq=0 Win=65535 Len=0 MSS=16344 WS=64 TSval=1429148538 TSecr=0 SACK_PERM
    2   0.000144    127.0.0.1 → 127.0.0.1    TCP 68 50051 → 62142 [SYN, ACK] Seq=0 Ack=1 Win=65535 Len=0 MSS=16344 WS=64 TSval=2562678083 TSecr=1429148538 SACK_PERM
    3   0.000170    127.0.0.1 → 127.0.0.1    TCP 56 62142 → 50051 [ACK] Seq=1 Ack=1 Win=408256 Len=0 TSval=1429148538 TSecr=2562678083
    4   0.000187    127.0.0.1 → 127.0.0.1    TCP 56 [TCP Window Update] 50051 → 62142 [ACK] Seq=1 Ack=1 Win=408256 Len=0 TSval=2562678083 TSecr=1429148538
    5   0.000438    127.0.0.1 → 127.0.0.1    HTTP2 80 Magic
    6   0.000465    127.0.0.1 → 127.0.0.1    TCP 56 50051 → 62142 [ACK] Seq=1 Ack=25 Win=408256 Len=0 TSval=2562678083 TSecr=1429148538
    7   0.000507    127.0.0.1 → 127.0.0.1    HTTP2 65 SETTINGS[0]
    8   0.000536    127.0.0.1 → 127.0.0.1    TCP 56 50051 → 62142 [ACK] Seq=1 Ack=34 Win=408256 Len=0 TSval=2562678083 TSecr=1429148538
    9   0.001458    127.0.0.1 → 127.0.0.1    HTTP2 71 SETTINGS[0]
   10   0.001485    127.0.0.1 → 127.0.0.1    TCP 56 62142 → 50051 [ACK] Seq=34 Ack=16 Win=408256 Len=0 TSval=1429148539 TSecr=2562678084
   11   0.001667    127.0.0.1 → 127.0.0.1    HTTP2 65 SETTINGS[0]
   12   0.001691    127.0.0.1 → 127.0.0.1    TCP 56 50051 → 62142 [ACK] Seq=16 Ack=43 Win=408256 Len=0 TSval=2562678084 TSecr=1429148539
   13   0.001766    127.0.0.1 → 127.0.0.1    HTTP2 162 HEADERS[1]: POST /helloworld.GreeterService/SayHello
   14   0.001793    127.0.0.1 → 127.0.0.1    TCP 56 50051 → 62142 [ACK] Seq=16 Ack=149 Win=408128 Len=0 TSval=2562678084 TSecr=1429148539
   15   0.001931    127.0.0.1 → 127.0.0.1    GRPC 77 DATA[1] (GRPC) (PROTOBUF)
   16   0.001952    127.0.0.1 → 127.0.0.1    TCP 56 50051 → 62142 [ACK] Seq=16 Ack=170 Win=408128 Len=0 TSval=2562678084 TSecr=1429148539
   17   0.002638    127.0.0.1 → 127.0.0.1    HTTP2 65 SETTINGS[0]
   18   0.002678    127.0.0.1 → 127.0.0.1    TCP 56 62142 → 50051 [ACK] Seq=170 Ack=25 Win=408256 Len=0 TSval=1429148540 TSecr=2562678085
   19   0.004004    127.0.0.1 → 127.0.0.1    HTTP2 86 WINDOW_UPDATE[0], PING[0]
   20   0.004050    127.0.0.1 → 127.0.0.1    TCP 56 62142 → 50051 [ACK] Seq=170 Ack=55 Win=408192 Len=0 TSval=1429148542 TSecr=2562678087
   21   0.004177    127.0.0.1 → 127.0.0.1    HTTP2 73 PING[0]
   22   0.004223    127.0.0.1 → 127.0.0.1    TCP 56 50051 → 62142 [ACK] Seq=55 Ack=187 Win=408064 Len=0 TSval=2562678087 TSecr=1429148542
   23   0.006029    127.0.0.1 → 127.0.0.1    GRPC 106 HEADERS[1]: 200 OK, DATA[1] (GRPC) (PROTOBUF)
   24   0.006091    127.0.0.1 → 127.0.0.1    TCP 56 62142 → 50051 [ACK] Seq=187 Ack=105 Win=408192 Len=0 TSval=1429148544 TSecr=2562678089
   25   0.006646    127.0.0.1 → 127.0.0.1    HTTP2 86 WINDOW_UPDATE[0], PING[0]
   26   0.006684    127.0.0.1 → 127.0.0.1    TCP 56 50051 → 62142 [ACK] Seq=105 Ack=217 Win=408064 Len=0 TSval=2562678089 TSecr=1429148544
   27   0.006880    127.0.0.1 → 127.0.0.1    HTTP2 106 PING[0], HEADERS[1]
   28   0.006912    127.0.0.1 → 127.0.0.1    TCP 56 62142 → 50051 [ACK] Seq=217 Ack=155 Win=408128 Len=0 TSval=1429148544 TSecr=2562678089
   29   0.009150    127.0.0.1 → 127.0.0.1    TCP 56 62142 → 50051 [FIN, ACK] Seq=217 Ack=155 Win=408128 Len=0 TSval=1429148546 TSecr=2562678089
   30   0.009235    127.0.0.1 → 127.0.0.1    TCP 56 50051 → 62142 [ACK] Seq=155 Ack=218 Win=408064 Len=0 TSval=2562678091 TSecr=1429148546
   31   0.009358    127.0.0.1 → 127.0.0.1    TCP 56 50051 → 62142 [FIN, ACK] Seq=155 Ack=218 Win=408064 Len=0 TSval=2562678092 TSecr=1429148546
   32   0.009447    127.0.0.1 → 127.0.0.1    TCP 56 62142 → 50051 [ACK] Seq=218 Ack=156 Win=408128 Len=0 TSval=1429148547 TSecr=2562678092
